{
  "languages": ["en", "fr", "ar"],
  "ui": [
    { "key": "Help", "en": "Help", "fr": "Aide", "ar": "مساعدة" }
  ],
  "messages": [
    { "key": "RF_Hypoxia", "en": "Low oxygen", "fr": "Hypoxie", "ar": "نقص الأكسجين" }
  ],
  "symptoms": [
    { "key": "Cough", "fr": "Toux", "ar": "سعال" }
  ],
  "conditions": [
    { "key": "Pneumonia", "fr": "Pneumonie", "ar": "ذات الرئة" }
  ],
  "categories": [
    { "key": "Respiratory", "fr": "Respiratoire", "ar": "تنفسي" }
  ],
  "ui_details": [
    { "key": "Help_Title", "en": "About", "fr": "À propos", "ar": "حول" }
  ]
}
